{
  "$schema": "https://json-schema.org/draft/2020-12/schema",
  "$id": "https://feed.vakter.app/schema/categories/sms-templates.schema.json",
  "title": "Vakter threat-feed — sms-templates.json",
  "description": "Regex patterns for known scam SMS message bodies. Top-level is a JSON array. Canonical spec: openspec/changes/vakter-watch-pivot/specs/threat-feed/bundle-schema.md",
  "type": "array",
  "items": {
    "type": "object",
    "additionalProperties": false,
    "required": ["id", "pattern", "category", "source_id", "first_seen"],
    "properties": {
      "id": {
        "type": "string",
        "pattern": "^[a-z][a-z0-9-]*$",
        "description": "Unique stable handle for this pattern. Used in 'why was this flagged?' UI."
      },
      "pattern": {
        "type": "string",
        "minLength": 1,
        "description": "ICU/POSIX-extended regex. Anchors and lookahead forbidden. Must be cheap to evaluate on-device."
      },
      "category": {
        "type": "string",
        "pattern": "^[a-z][a-z0-9-]*$",
        "description": "SMS scam sub-category (e.g. package-impersonation, bank-otp-phish, irs-impersonation)."
      },
      "source_id": {
        "type": "string",
        "pattern": "^[a-z][a-z0-9-]*$",
        "description": "Foreign key into sources.json."
      },
      "first_seen": {
        "type": "string",
        "format": "date",
        "description": "Date first observed."
      }
    }
  }
}
