[
  {
    "id": "usps-redelivery-2026-05",
    "pattern": "USPS:.{0,40}redelivery.{0,40}https?://",
    "category": "package-impersonation",
    "source_id": "fcc-scam-report-2026-05-15",
    "first_seen": "2026-05-15"
  },
  {
    "id": "bank-otp-phish-2026-05",
    "pattern": "(?i)(chase|wells fargo|hsbc).{0,30}verify.{0,30}https?://",
    "category": "bank-otp-phish",
    "source_id": "phishtank-2026-05-29",
    "first_seen": "2026-05-19"
  },
  {
    "id": "irs-impersonation-2026-05",
    "pattern": "(?i)IRS.{0,40}(arrest|warrant|seizure).{0,40}\\+1",
    "category": "irs-impersonation",
    "source_id": "fcc-scam-report-2026-05-15",
    "first_seen": "2026-05-22"
  }
]
